{
  "schema_version": "1.0",
  "capability_id": "research.monitor.create",
  "description": "Create a monitored research subscription for the active pod.",
  "side_effect_class": "local_artifact",
  "result_type": "json",
  "owner_team": "ai-platform",
  "implementation": {
    "protocol": "python_internal",
    "service_ref": "workspace-api",
    "operation": "create_monitor"
  },
  "input_schema_ref": "podos_contracts.models.create_monitor",
  "requires_approval": false,
  "supports_idempotency": true,
  "default_timeout_seconds": 30
}